{
  "version": "1.0",
  "subject": {
    "name": "John Malone",
    "profiles": [
      {"kind": "github", "url": "https://github.com/Pro777"},
      {"kind": "other", "url": "https://hackerone.com/apylon777"}
    ]
  },
  "artifacts": [
    {
      "kind": "other",
      "name": "HackerOne report #3618622: Claude Code bash-guard bypass via compound shell commands",
      "url": "https://hackerone.com/reports/3618622",
      "verify": [
        {
          "kind": "note",
          "note": "Submitted to Anthropic VDP (anthropic-vdp) on HackerOne on Mar 20, 2026. Reports that Claude Code's bash-guard PreToolUse hook does not split compound commands on shell operators (&&, ||, ;, |), allowing a deny rule for a standalone command (e.g. rm -rf) to be bypassed via chaining. Fix already written in PR #36645. Report ID: 3618622.",
          "source": "hackerone.com",
          "observed_at": "2026-03-20T18:00:00Z"
        }
      ]
    },
    {
      "kind": "other",
      "name": "Claude Code issue #36637: PreToolUse/PostToolUse hooks fire twice per tool call",
      "url": "https://github.com/anthropics/claude-code/issues/36637",
      "verify": [
        {
          "kind": "note",
          "note": "Original public disclosure of the double-invocation root cause. Filed earlier this session. HackerOne report references this issue and the associated fix PR #36645.",
          "source": "github.com",
          "observed_at": "2026-03-20T10:00:00Z"
        }
      ]
    }
  ],
  "meta": {
    "created_at": "2026-03-20T18:00:00Z",
    "generator": "ship-receipts-cli/1.0.0",
    "tags": ["bug-bounty", "responsible-disclosure", "hackerone", "claude-code", "bash-guard", "proofofship-dogfood"]
  }
}
