{
  "version": "1.0",
  "subject": {
    "name": "Example Builder",
    "profiles": [
      {"kind": "github", "url": "https://github.com/example-org"},
      {"kind": "other", "url": "https://hackerone.com/example-builder"}
    ]
  },
  "artifacts": [
    {
      "kind": "other",
      "name": "Security report: command-policy bypass via compound shell operators",
      "url": "https://hackerone.com/reports/0000000",
      "verify": [
        {
          "kind": "note",
          "note": "Submitted to a vendor VDP on Mar 20, 2026. Report describes a command policy bypass in compound shell expressions and includes reproduction details plus mitigations.",
          "source": "hackerone.com",
          "observed_at": "2026-03-20T18:00:00Z"
        }
      ]
    },
    {
      "kind": "other",
      "name": "Upstream issue: duplicate hook invocation",
      "url": "https://github.com/example-org/example-cli/issues/123",
      "verify": [
        {
          "kind": "note",
          "note": "Public issue documenting duplicate callback invocation and impact on policy enforcement.",
          "source": "github.com",
          "observed_at": "2026-03-20T10:00:00Z"
        }
      ]
    }
  ],
  "meta": {
    "created_at": "2026-03-20T18:00:00Z",
    "generator": "ship-receipts-cli/1.0.0",
    "tags": ["bug-bounty", "responsible-disclosure", "security", "policy", "example"]
  }
}
